{
  "_schema": "file",
  "_id": "3fa85f64-5717-4562-b3fc-2c963f66afa6",
  "_org": "123",
  "_title": "Entity Title",
  "_tags": [
    "family:label"
  ],
  "_purpose": [
    "7675dc56-fd1b-46ee-9c35-defe0667b32e"
  ],
  "_thumbnail": {
    "$relation": [
      {
        "entity_id": "123e4567-e89b-12d3-a456-426614174000",
        "_tags": [
          "example"
        ]
      }
    ]
  },
  "filename": "string",
  "mime_type": "string",
  "type": "document",
  "readable_size": "string",
  "language": "de",
  "alt_text": "string",
  "access_control": "private",
  "public_url": "string",
  "shared_with_end_customer": true,
  "category": "address-suggestions",
  "file_date": "2025-01-01",
  "external_id": "string",
  "preview_summary_de": "string",
  "short_summary_de": "string",
  "preview_summary_en": "string",
  "short_summary_en": "string",
  "summary_status": "processing",
  "_files": {
    "$relation": [
      {
        "entity_id": "123e4567-e89b-12d3-a456-426614174000",
        "_tags": [
          "example"
        ]
      }
    ]
  },
  "_created_at": "1970-01-01T00:00:00.000Z",
  "_updated_at": "1970-01-01T00:00:00.000Z",
  "_owners": [
    {
      "org_id": "123",
      "user_id": "456"
    }
  ],
  "_acl": {
    "view": [
      "org:456"
    ],
    "edit": [
      "org:456"
    ],
    "delete": [
      "org:456"
    ]
  },
  "_manifest": [
    "123e4567-e89b-12d3-a456-426614174000"
  ]
}